{
 "delimiters": {
  "format": "comment-v1"
 },
 "graphs": [
  {
   "componentClasses": [
    {
     "classId": "Host_4d8d7d",
     "className": "Host"
    }
   ],
   "componentExecutionOrderConstraints": [],
   "componentInstances": [
    {
     "classId": "Host_4d8d7d",
     "instanceId": 1,
     "invocationId": null,
     "parentRenderId": null,
     "renderId": "c1",
     "transparent": false
    }
   ],
   "fills": [],
   "graphId": 0,
   "nestedComponents": [],
   "slotRegions": [],
   "sourceLocations": []
  }
 ],
 "mode": "development",
 "protocol": "citry-client-graph/1",
 "revision": "70b9bc976275ffc468e724d68aa149837dbb25a8a6949ae2a99f6cf3fc702dd7"
}
