{
 "delimiters": {
  "format": "comment-v1"
 },
 "graphs": [
  {
   "componentClasses": [
    {
     "classId": "Page_df2715",
     "className": "Page"
    },
    {
     "classId": "Child_3b64a6",
     "className": "Child"
    }
   ],
   "componentExecutionOrderConstraints": [
    {
     "childRenderId": "c2",
     "invocationId": 1,
     "parentRenderId": "c1"
    }
   ],
   "componentInstances": [
    {
     "classId": "Page_df2715",
     "instanceId": 1,
     "invocationId": null,
     "parentRenderId": null,
     "renderId": "c1",
     "transparent": false
    },
    {
     "classId": "Child_3b64a6",
     "instanceId": 2,
     "invocationId": 1,
     "parentRenderId": "c1",
     "renderId": "c2",
     "transparent": false
    }
   ],
   "fills": [],
   "graphId": 0,
   "nestedComponents": [
    {
     "invocationId": 1,
     "locationId": 7,
     "parentRegionId": null,
     "relays": [
      {
       "key": "$c-props",
       "locationId": 1,
       "payload": {
        "expression": "{n: 1}",
        "type": "props"
       },
       "source": "direct"
      },
      {
       "key": "@click",
       "locationId": 2,
       "payload": {
        "expression": "open = true",
        "type": "alpine-handler"
       },
       "source": "direct"
      },
      {
       "key": "@c-click.prevent",
       "locationId": 3,
       "payload": {
        "args": "{x: 1}",
        "classId": "Page_df2715",
        "debounce": null,
        "event": "click",
        "handler": "save",
        "key": null,
        "once": false,
        "prevent": true,
        "self": false,
        "stop": false,
        "throttle": null,
        "type": "citry-dom-event"
       },
       "source": "direct"
      },
      {
       "key": "@c-keyup.enter.debounce.300ms",
       "locationId": 4,
       "payload": {
        "args": "{y: 2}",
        "classId": "Page_df2715",
        "debounce": 300,
        "event": "keyup",
        "handler": "save",
        "key": "enter",
        "once": false,
        "prevent": false,
        "self": false,
        "stop": false,
        "throttle": null,
        "type": "citry-dom-event"
       },
       "source": "direct"
      },
      {
       "key": "@c-pollchange",
       "locationId": 5,
       "payload": {
        "args": "{z: 3}",
        "classId": "Page_df2715",
        "debounce": null,
        "event": "pollchange",
        "handler": "save",
        "key": null,
        "once": false,
        "prevent": false,
        "self": false,
        "stop": false,
        "throttle": null,
        "type": "citry-dom-event"
       },
       "source": "direct"
      },
      {
       "key": "@c-poll.5s",
       "locationId": 6,
       "payload": {
        "args": null,
        "classId": "Page_df2715",
        "handler": "tick",
        "interval": 5000,
        "type": "citry-poll"
       },
       "source": "direct"
      }
     ],
     "sourceClassId": "Page_df2715",
     "sourceRenderId": "c1",
     "tagName": "child",
     "targetClassId": "Child_3b64a6",
     "targetRenderId": "c2"
    }
   ],
   "slotRegions": [],
   "sourceLocations": [
    {
     "carrierInstanceId": 1,
     "kind": "boundary-relay",
     "locationId": 1,
     "mappingIndex": null,
     "mappingKey": null,
     "origin": "fixture://Page",
     "ownerClassId": "Page_df2715",
     "ownerRenderId": "c1",
     "sourceOffset": {
      "end": 57,
      "start": 40
     },
     "sourcePos": {
      "column": 17,
      "line": 3
     }
    },
    {
     "carrierInstanceId": 1,
     "kind": "boundary-relay",
     "locationId": 2,
     "mappingIndex": null,
     "mappingKey": null,
     "origin": "fixture://Page",
     "ownerClassId": "Page_df2715",
     "ownerRenderId": "c1",
     "sourceOffset": {
      "end": 94,
      "start": 74
     },
     "sourcePos": {
      "column": 17,
      "line": 4
     }
    },
    {
     "carrierInstanceId": 1,
     "kind": "boundary-relay",
     "locationId": 3,
     "mappingIndex": null,
     "mappingKey": null,
     "origin": "fixture://Page",
     "ownerClassId": "Page_df2715",
     "ownerRenderId": "c1",
     "sourceOffset": {
      "end": 142,
      "start": 111
     },
     "sourcePos": {
      "column": 17,
      "line": 5
     }
    },
    {
     "carrierInstanceId": 1,
     "kind": "boundary-relay",
     "locationId": 4,
     "mappingIndex": null,
     "mappingKey": null,
     "origin": "fixture://Page",
     "ownerClassId": "Page_df2715",
     "ownerRenderId": "c1",
     "sourceOffset": {
      "end": 203,
      "start": 159
     },
     "sourcePos": {
      "column": 17,
      "line": 6
     }
    },
    {
     "carrierInstanceId": 1,
     "kind": "boundary-relay",
     "locationId": 5,
     "mappingIndex": null,
     "mappingKey": null,
     "origin": "fixture://Page",
     "ownerClassId": "Page_df2715",
     "ownerRenderId": "c1",
     "sourceOffset": {
      "end": 248,
      "start": 220
     },
     "sourcePos": {
      "column": 17,
      "line": 7
     }
    },
    {
     "carrierInstanceId": 1,
     "kind": "boundary-relay",
     "locationId": 6,
     "mappingIndex": null,
     "mappingKey": null,
     "origin": "fixture://Page",
     "ownerClassId": "Page_df2715",
     "ownerRenderId": "c1",
     "sourceOffset": {
      "end": 284,
      "start": 265
     },
     "sourcePos": {
      "column": 17,
      "line": 8
     }
    },
    {
     "carrierInstanceId": 1,
     "kind": "component-call",
     "locationId": 7,
     "mappingIndex": null,
     "mappingKey": null,
     "origin": "fixture://Page",
     "ownerClassId": "Page_df2715",
     "ownerRenderId": "c1",
     "sourceOffset": {
      "end": 301,
      "start": 15
     },
     "sourcePos": {
      "column": 15,
      "line": 2
     }
    }
   ]
  }
 ],
 "mode": "development",
 "protocol": "citry-client-graph/1",
 "revision": "d9d6e4a9768405c207fcef9e8ee4066928b6a77f08f1845a837997962d0d4143"
}
