{
 "delimiters": {
  "format": "comment-v1"
 },
 "graphs": [
  {
   "componentClasses": [
    {
     "classId": "Page_df2715",
     "className": "Page"
    },
    {
     "classId": "Card_0f1c15",
     "className": "Card"
    }
   ],
   "componentExecutionOrderConstraints": [
    {
     "childRenderId": "c2",
     "invocationId": 1,
     "parentRenderId": "c1"
    }
   ],
   "componentInstances": [
    {
     "classId": "Page_df2715",
     "instanceId": 1,
     "invocationId": null,
     "parentRenderId": null,
     "renderId": "c1",
     "transparent": false
    },
    {
     "classId": "Card_0f1c15",
     "instanceId": 2,
     "invocationId": 1,
     "parentRenderId": "c1",
     "renderId": "c2",
     "transparent": false
    }
   ],
   "fills": [
    {
     "fallbackLocationId": null,
     "fillId": 1,
     "kind": "named",
     "locationId": 1,
     "ownerClassId": "Page_df2715",
     "ownerRenderId": "c1",
     "policy": "template",
     "receiverClassId": "Card_0f1c15",
     "receiverRenderId": "c2",
     "slotName": "title",
     "sourceInvocationId": 1
    }
   ],
   "graphId": 0,
   "nestedComponents": [
    {
     "invocationId": 1,
     "locationId": 2,
     "parentRegionId": null,
     "relays": [],
     "sourceClassId": "Page_df2715",
     "sourceRenderId": "c1",
     "tagName": "card",
     "targetClassId": "Card_0f1c15",
     "targetRenderId": "c2"
    }
   ],
   "slotRegions": [
    {
     "fillId": 1,
     "ownerRenderId": "c1",
     "parentRegionId": null,
     "receiverRenderId": "c2",
     "regionId": 1,
     "resultOwnerRenderId": "c1",
     "slotLocationId": 3,
     "sourceLocationId": 1,
     "transitionFromRenderId": "c2"
    },
    {
     "fillId": 1,
     "ownerRenderId": "c1",
     "parentRegionId": null,
     "receiverRenderId": "c2",
     "regionId": 2,
     "resultOwnerRenderId": "c1",
     "slotLocationId": 5,
     "sourceLocationId": 1,
     "transitionFromRenderId": "c2"
    }
   ],
   "sourceLocations": [
    {
     "carrierInstanceId": 1,
     "kind": "named-fill",
     "locationId": 1,
     "mappingIndex": null,
     "mappingKey": null,
     "origin": "fixture://Page",
     "ownerClassId": "Page_df2715",
     "ownerRenderId": "c1",
     "sourceOffset": {
      "end": 92,
      "start": 40
     },
     "sourcePos": {
      "column": 17,
      "line": 3
     }
    },
    {
     "carrierInstanceId": 1,
     "kind": "component-call",
     "locationId": 2,
     "mappingIndex": null,
     "mappingKey": null,
     "origin": "fixture://Page",
     "ownerClassId": "Page_df2715",
     "ownerRenderId": "c1",
     "sourceOffset": {
      "end": 116,
      "start": 15
     },
     "sourcePos": {
      "column": 15,
      "line": 2
     }
    },
    {
     "carrierInstanceId": 2,
     "kind": "slot-outlet",
     "locationId": 3,
     "mappingIndex": null,
     "mappingKey": null,
     "origin": "fixture://Card",
     "ownerClassId": "Card_0f1c15",
     "ownerRenderId": "c2",
     "sourceOffset": {
      "end": 72,
      "start": 49
     },
     "sourcePos": {
      "column": 25,
      "line": 3
     }
    },
    {
     "carrierInstanceId": 2,
     "kind": "slot-outlet",
     "locationId": 5,
     "mappingIndex": null,
     "mappingKey": null,
     "origin": "fixture://Card",
     "ownerClassId": "Card_0f1c15",
     "ownerRenderId": "c2",
     "sourceOffset": {
      "end": 128,
      "start": 105
     },
     "sourcePos": {
      "column": 24,
      "line": 4
     }
    }
   ]
  }
 ],
 "mode": "development",
 "protocol": "citry-client-graph/1",
 "revision": "baa0066aaa718a77ce0ee4eab4f4f15cc25214fdce6737005a97aaae9e98f670"
}
