{
 "delimiters": {
  "format": "comment-v1"
 },
 "graphs": [
  {
   "componentClasses": [
    {
     "classId": "Page_df2715",
     "className": "Page"
    },
    {
     "classId": "Cache_bf12ad",
     "className": "Cache"
    },
    {
     "classId": "Active_8f0832",
     "className": "Active"
    }
   ],
   "componentExecutionOrderConstraints": [
    {
     "childRenderId": "c4",
     "invocationId": 3,
     "parentRenderId": "c1"
    }
   ],
   "componentInstances": [
    {
     "classId": "Page_df2715",
     "instanceId": 1,
     "invocationId": null,
     "parentRenderId": null,
     "renderId": "c1",
     "transparent": false
    },
    {
     "classId": "Cache_bf12ad",
     "instanceId": 2,
     "invocationId": 1,
     "parentRenderId": "c1",
     "renderId": "c2",
     "transparent": true
    },
    {
     "classId": "Cache_bf12ad",
     "instanceId": 3,
     "invocationId": 2,
     "parentRenderId": "c1",
     "renderId": "c3",
     "transparent": true
    },
    {
     "classId": "Active_8f0832",
     "instanceId": 4,
     "invocationId": 3,
     "parentRenderId": "c1",
     "renderId": "c4",
     "transparent": false
    }
   ],
   "fills": [
    {
     "fallbackLocationId": null,
     "fillId": 1,
     "kind": "implicit",
     "locationId": 1,
     "ownerClassId": "Page_df2715",
     "ownerRenderId": "c1",
     "policy": "template",
     "receiverClassId": "Cache_bf12ad",
     "receiverRenderId": "c2",
     "slotName": "default",
     "sourceInvocationId": 1
    },
    {
     "fallbackLocationId": null,
     "fillId": 3,
     "kind": "implicit",
     "locationId": 5,
     "ownerClassId": "Page_df2715",
     "ownerRenderId": "c1",
     "policy": "template",
     "receiverClassId": "Cache_bf12ad",
     "receiverRenderId": "c3",
     "slotName": "default",
     "sourceInvocationId": 2
    }
   ],
   "graphId": 0,
   "nestedComponents": [
    {
     "invocationId": 1,
     "locationId": 2,
     "parentRegionId": null,
     "relays": [],
     "sourceClassId": "Page_df2715",
     "sourceRenderId": "c1",
     "tagName": "cache",
     "targetClassId": "Cache_bf12ad",
     "targetRenderId": "c2"
    },
    {
     "invocationId": 2,
     "locationId": 6,
     "parentRegionId": 1,
     "relays": [],
     "sourceClassId": "Page_df2715",
     "sourceRenderId": "c1",
     "tagName": "cache",
     "targetClassId": "Cache_bf12ad",
     "targetRenderId": "c3"
    },
    {
     "invocationId": 3,
     "locationId": 9,
     "parentRegionId": 2,
     "relays": [],
     "sourceClassId": "Page_df2715",
     "sourceRenderId": "c1",
     "tagName": "active",
     "targetClassId": "Active_8f0832",
     "targetRenderId": "c4"
    }
   ],
   "slotRegions": [
    {
     "fillId": 1,
     "ownerRenderId": "c1",
     "parentRegionId": null,
     "receiverRenderId": "c2",
     "regionId": 1,
     "resultOwnerRenderId": "c1",
     "slotLocationId": 3,
     "sourceLocationId": 1,
     "transitionFromRenderId": "c2"
    },
    {
     "fillId": 3,
     "ownerRenderId": "c1",
     "parentRegionId": 1,
     "receiverRenderId": "c3",
     "regionId": 2,
     "resultOwnerRenderId": "c1",
     "slotLocationId": 7,
     "sourceLocationId": 5,
     "transitionFromRenderId": "c1"
    }
   ],
   "sourceLocations": [
    {
     "carrierInstanceId": 1,
     "kind": "implicit-fill",
     "locationId": 1,
     "mappingIndex": null,
     "mappingKey": null,
     "origin": "fixture://Page",
     "ownerClassId": "Page_df2715",
     "ownerRenderId": "c1",
     "sourceOffset": {
      "end": 157,
      "start": 15
     },
     "sourcePos": {
      "column": 15,
      "line": 2
     }
    },
    {
     "carrierInstanceId": 1,
     "kind": "component-call",
     "locationId": 2,
     "mappingIndex": null,
     "mappingKey": null,
     "origin": "fixture://Page",
     "ownerClassId": "Page_df2715",
     "ownerRenderId": "c1",
     "sourceOffset": {
      "end": 157,
      "start": 15
     },
     "sourcePos": {
      "column": 15,
      "line": 2
     }
    },
    {
     "carrierInstanceId": 2,
     "kind": "slot-outlet",
     "locationId": 3,
     "mappingIndex": null,
     "mappingKey": null,
     "origin": "fixture://Cache",
     "ownerClassId": "Cache_bf12ad",
     "ownerRenderId": "c2",
     "sourceOffset": {
      "end": 10,
      "start": 0
     },
     "sourcePos": {
      "column": 1,
      "line": 1
     }
    },
    {
     "carrierInstanceId": 1,
     "kind": "implicit-fill",
     "locationId": 5,
     "mappingIndex": null,
     "mappingKey": null,
     "origin": "fixture://Page",
     "ownerClassId": "Page_df2715",
     "ownerRenderId": "c1",
     "sourceOffset": {
      "end": 132,
      "start": 53
     },
     "sourcePos": {
      "column": 17,
      "line": 3
     }
    },
    {
     "carrierInstanceId": 1,
     "kind": "component-call",
     "locationId": 6,
     "mappingIndex": null,
     "mappingKey": null,
     "origin": "fixture://Page",
     "ownerClassId": "Page_df2715",
     "ownerRenderId": "c1",
     "sourceOffset": {
      "end": 132,
      "start": 53
     },
     "sourcePos": {
      "column": 17,
      "line": 3
     }
    },
    {
     "carrierInstanceId": 3,
     "kind": "slot-outlet",
     "locationId": 7,
     "mappingIndex": null,
     "mappingKey": null,
     "origin": "fixture://Cache",
     "ownerClassId": "Cache_bf12ad",
     "ownerRenderId": "c3",
     "sourceOffset": {
      "end": 10,
      "start": 0
     },
     "sourcePos": {
      "column": 1,
      "line": 1
     }
    },
    {
     "carrierInstanceId": 1,
     "kind": "component-call",
     "locationId": 9,
     "mappingIndex": null,
     "mappingKey": null,
     "origin": "fixture://Page",
     "ownerClassId": "Page_df2715",
     "ownerRenderId": "c1",
     "sourceOffset": {
      "end": 105,
      "start": 93
     },
     "sourcePos": {
      "column": 19,
      "line": 4
     }
    }
   ]
  }
 ],
 "mode": "development",
 "protocol": "citry-client-graph/1",
 "revision": "0e0e6d1bca208d5112586699451c0ae84022f278aded5cb576d98445be6192c5"
}
